{
  "schemaVersion": 1,
  "catalogId": "raise-don-quixote-limbus-library",
  "description": "Local, extensible Limbus content index. Don and Heathcliff assets supplied in this conversation have been imported with exact local paths; Drive folder contents remain pending until directly accessible.",
  "records": [
    {
      "id": "identity.don-quixote.base",
      "type": "identity",
      "name": "Don Quixote — Base",
      "characterId": "don",
      "source": "existing-project",
      "assetPaths": {
        "idle": "assets/images/battle/don/base/idle.png",
        "moving": "assets/images/battle/don/moving.png"
      },
      "skillIds": [
        "skill.don.joust",
        "skill.don.gallop",
        "skill.don.justice"
      ],
      "tags": [
        "don-quixote",
        "base-identity"
      ]
    },
    {
      "id": "skill.don.joust",
      "type": "skill",
      "name": "Joust",
      "characterId": "don",
      "input": "J",
      "moveId": "light",
      "animationKey": "joust",
      "voiceLineKey": "attacks.joust",
      "source": "existing-project"
    },
    {
      "id": "skill.don.gallop",
      "type": "skill",
      "name": "Gallop",
      "characterId": "don",
      "input": "K",
      "moveId": "heavy",
      "animationKey": "gallop",
      "voiceLineKey": "attacks.gallop",
      "source": "existing-project"
    },
    {
      "id": "skill.don.justice",
      "type": "skill",
      "name": "Justice",
      "characterId": "don",
      "input": "U",
      "moveId": "special",
      "animationKey": "justice",
      "voiceLineKey": "attacks.justice",
      "source": "existing-project"
    },
    {
      "id": "ego.don.la-sangre-de-sancho",
      "type": "ego",
      "name": "La Sangre de Sancho",
      "characterId": "don",
      "voiceLineKey": "attacks.laSangre",
      "source": "existing-project"
    },
    {
      "id": "voiceline.don.lcb.battle-select-10301-1-wav",
      "type": "voiceLine",
      "name": "Don Quixote — Battle Select",
      "characterId": "don",
      "voiceLineKey": "events.battleSelect",
      "assetPaths": {
        "audio": "assets/audio/voice-lines/don-lcb/battle_select_10301_1.wav"
      },
      "source": "user-provided-audio-archive",
      "sourceArchive": "LCB Sinner",
      "sourceFilename": "battle_select_10301_1.wav",
      "tags": [
        "don-quixote",
        "lcb-sinner",
        "voice-line"
      ]
    },
    {
      "id": "voiceline.don.lcb.formation-10301-1-wav",
      "type": "voiceLine",
      "name": "Don Quixote — Formation",
      "characterId": "don",
      "voiceLineKey": "events.formation",
      "assetPaths": {
        "audio": "assets/audio/voice-lines/don-lcb/formation_10301_1.wav"
      },
      "source": "user-provided-audio-archive",
      "sourceArchive": "LCB Sinner",
      "sourceFilename": "formation_10301_1.wav",
      "tags": [
        "don-quixote",
        "lcb-sinner",
        "voice-line"
      ]
    },
    {
      "id": "voiceline.don.lcb.battle-allydead-10301-1-wav",
      "type": "voiceLine",
      "name": "Don Quixote — Ally Dead",
      "characterId": "don",
      "voiceLineKey": "events.allyDead",
      "assetPaths": {
        "audio": "assets/audio/voice-lines/don-lcb/battle_allydead_10301_1.wav"
      },
      "source": "user-provided-audio-archive",
      "sourceArchive": "LCB Sinner",
      "sourceFilename": "battle_allydead_10301_1.wav",
      "tags": [
        "don-quixote",
        "lcb-sinner",
        "voice-line"
      ]
    },
    {
      "id": "voiceline.don.lcb.battle-s2-10301-1-wav",
      "type": "voiceLine",
      "name": "Don Quixote — Skill 2 Callout",
      "characterId": "don",
      "voiceLineKey": "attacks.gallop",
      "assetPaths": {
        "audio": "assets/audio/voice-lines/don-lcb/battle_s2_10301_1.wav"
      },
      "source": "user-provided-audio-archive",
      "sourceArchive": "LCB Sinner",
      "sourceFilename": "battle_s2_10301_1.wav",
      "tags": [
        "don-quixote",
        "lcb-sinner",
        "voice-line"
      ]
    },
    {
      "id": "voiceline.don.lcb.lobby-noon-10301-1-wav",
      "type": "voiceLine",
      "name": "Don Quixote — Lobby Noon",
      "characterId": "don",
      "voiceLineKey": "ambient.lobbyNoon",
      "assetPaths": {
        "audio": "assets/audio/voice-lines/don-lcb/lobby_noon_10301_1.wav"
      },
      "source": "user-provided-audio-archive",
      "sourceArchive": "LCB Sinner",
      "sourceFilename": "lobby_noon_10301_1.wav",
      "tags": [
        "don-quixote",
        "lcb-sinner",
        "voice-line"
      ]
    },
    {
      "id": "voiceline.don.lcb.lobby-night-10301-1-wav",
      "type": "voiceLine",
      "name": "Don Quixote — Lobby Night",
      "characterId": "don",
      "voiceLineKey": "ambient.lobbyNight",
      "assetPaths": {
        "audio": "assets/audio/voice-lines/don-lcb/lobby_night_10301_1.wav"
      },
      "source": "user-provided-audio-archive",
      "sourceArchive": "LCB Sinner",
      "sourceFilename": "lobby_night_10301_1.wav",
      "tags": [
        "don-quixote",
        "lcb-sinner",
        "voice-line"
      ]
    },
    {
      "id": "voiceline.don.lcb.battle-break-10301-1-wav",
      "type": "voiceLine",
      "name": "Don Quixote — Broken",
      "characterId": "don",
      "voiceLineKey": "events.broken",
      "assetPaths": {
        "audio": "assets/audio/voice-lines/don-lcb/battle_break_10301_1.wav"
      },
      "source": "user-provided-audio-archive",
      "sourceArchive": "LCB Sinner",
      "sourceFilename": "battle_break_10301_1.wav",
      "tags": [
        "don-quixote",
        "lcb-sinner",
        "voice-line"
      ]
    },
    {
      "id": "voiceline.don.lcb.get-10301-1-wav",
      "type": "voiceLine",
      "name": "Don Quixote — Obtained",
      "characterId": "don",
      "voiceLineKey": "events.get",
      "assetPaths": {
        "audio": "assets/audio/voice-lines/don-lcb/get_10301_1.wav"
      },
      "source": "user-provided-audio-archive",
      "sourceArchive": "LCB Sinner",
      "sourceFilename": "get_10301_1.wav",
      "tags": [
        "don-quixote",
        "lcb-sinner",
        "voice-line"
      ]
    },
    {
      "id": "voiceline.don.lcb.battle-endcommand-10301-1-wav",
      "type": "voiceLine",
      "name": "Don Quixote — End Command",
      "characterId": "don",
      "voiceLineKey": "events.endCommand",
      "assetPaths": {
        "audio": "assets/audio/voice-lines/don-lcb/battle_endcommand_10301_1.wav"
      },
      "source": "user-provided-audio-archive",
      "sourceArchive": "LCB Sinner",
      "sourceFilename": "battle_endcommand_10301_1.wav",
      "tags": [
        "don-quixote",
        "lcb-sinner",
        "voice-line"
      ]
    },
    {
      "id": "voiceline.don.lcb.neglect-10301-1-wav",
      "type": "voiceLine",
      "name": "Don Quixote — Neglect",
      "characterId": "don",
      "voiceLineKey": "ambient.neglect",
      "assetPaths": {
        "audio": "assets/audio/voice-lines/don-lcb/neglect_10301_1.wav"
      },
      "source": "user-provided-audio-archive",
      "sourceArchive": "LCB Sinner",
      "sourceFilename": "neglect_10301_1.wav",
      "tags": [
        "don-quixote",
        "lcb-sinner",
        "voice-line"
      ]
    },
    {
      "id": "voiceline.don.lcb.choice-success-p-10301-1-wav",
      "type": "voiceLine",
      "name": "Don Quixote — Choice Success Positive",
      "characterId": "don",
      "voiceLineKey": "events.choiceSuccessPositive",
      "assetPaths": {
        "audio": "assets/audio/voice-lines/don-lcb/choice_success_p_10301_1.wav"
      },
      "source": "user-provided-audio-archive",
      "sourceArchive": "LCB Sinner",
      "sourceFilename": "choice_success_p_10301_1.wav",
      "tags": [
        "don-quixote",
        "lcb-sinner",
        "voice-line"
      ]
    },
    {
      "id": "voiceline.don.lcb.smalltalk-10301-2-wav",
      "type": "voiceLine",
      "name": "Don Quixote — Small Talk 2",
      "characterId": "don",
      "voiceLineKey": "ambient.smalltalk",
      "assetPaths": {
        "audio": "assets/audio/voice-lines/don-lcb/smalltalk_10301_2.wav"
      },
      "source": "user-provided-audio-archive",
      "sourceArchive": "LCB Sinner",
      "sourceFilename": "smalltalk_10301_2.wav",
      "tags": [
        "don-quixote",
        "lcb-sinner",
        "voice-line"
      ]
    },
    {
      "id": "voiceline.don.lcb.choice-fail-n-10301-1-wav",
      "type": "voiceLine",
      "name": "Don Quixote — Choice Fail Neutral",
      "characterId": "don",
      "voiceLineKey": "events.choiceFailNeutral",
      "assetPaths": {
        "audio": "assets/audio/voice-lines/don-lcb/choice_fail_n_10301_1.wav"
      },
      "source": "user-provided-audio-archive",
      "sourceArchive": "LCB Sinner",
      "sourceFilename": "choice_fail_n_10301_1.wav",
      "tags": [
        "don-quixote",
        "lcb-sinner",
        "voice-line"
      ]
    },
    {
      "id": "voiceline.don.lcb.choice-fail-p-10301-1-wav",
      "type": "voiceLine",
      "name": "Don Quixote — Choice Fail Positive",
      "characterId": "don",
      "voiceLineKey": "events.choiceFailPositive",
      "assetPaths": {
        "audio": "assets/audio/voice-lines/don-lcb/choice_fail_p_10301_1.wav"
      },
      "source": "user-provided-audio-archive",
      "sourceArchive": "LCB Sinner",
      "sourceFilename": "choice_fail_p_10301_1.wav",
      "tags": [
        "don-quixote",
        "lcb-sinner",
        "voice-line"
      ]
    },
    {
      "id": "voiceline.don.lcb.battleentry-10301-1-wav",
      "type": "voiceLine",
      "name": "Don Quixote — Battle Entry",
      "characterId": "don",
      "voiceLineKey": "events.encounterStart",
      "assetPaths": {
        "audio": "assets/audio/voice-lines/don-lcb/battleentry_10301_1.wav"
      },
      "source": "user-provided-audio-archive",
      "sourceArchive": "LCB Sinner",
      "sourceFilename": "battleentry_10301_1.wav",
      "tags": [
        "don-quixote",